{
  "$schema": "http://json-schema.org/draft-07/schema#",
  "$id": "https://github.com/liatrio/arc/schemas/brief.schema.json",
  "title": "Brief",
  "description": "The spec-ready brief produced by /arc-shape and consumed by /cw-spec. Mirrors the format defined in references/brief-format.md: problem, proposed solution, success criteria (>=3), constraints, assumptions, wave assignment, and open questions. Every string field enforces a non-trivial minimum length so validators can catch placeholder-only briefs.",
  "type": "object",
  "required": [
    "title",
    "problem",
    "proposed_solution",
    "success_criteria",
    "constraints",
    "assumptions",
    "wave_assignment",
    "open_questions"
  ],
  "additionalProperties": false,
  "properties": {
    "title": {
      "type": "string",
      "minLength": 1,
      "description": "Idea title, matching the BACKLOG entry."
    },
    "problem": {
      "type": "string",
      "minLength": 40,
      "description": "1-3 sentences identifying who is affected, the pain point, and the impact."
    },
    "proposed_solution": {
      "type": "string",
      "minLength": 20,
      "description": "1-2 sentences describing the capability the solution unlocks (not the implementation)."
    },
    "success_criteria": {
      "type": "array",
      "minItems": 3,
      "items": {
        "type": "string",
        "minLength": 1
      },
      "description": "At least three independently-verifiable outcomes (measurable or binary)."
    },
    "constraints": {
      "type": "array",
      "minItems": 1,
      "items": {
        "type": "string",
        "minLength": 1
      },
      "description": "Bounding limitations (time, technical, team, scope, compliance). Use a single 'No constraints identified' entry if none apply."
    },
    "assumptions": {
      "type": "array",
      "minItems": 1,
      "items": {
        "type": "string",
        "minLength": 1
      },
      "description": "Statements that must hold for the solution to work. Use a single 'No assumptions identified' entry if none apply."
    },
    "wave_assignment": {
      "type": "string",
      "minLength": 1,
      "description": "ROADMAP wave reference (e.g. 'Wave 1: Plugin Foundation') or the literal string 'Unassigned'."
    },
    "open_questions": {
      "oneOf": [
        {
          "type": "array",
          "items": { "type": "string", "minLength": 1 },
          "description": "List of outstanding questions."
        },
        {
          "type": "string",
          "enum": ["None"],
          "description": "Literal 'None' when shaping resolved all questions."
        }
      ],
      "description": "Either an array of question strings or the literal string 'None'."
    }
  }
}
